{
  "id": "twitch",
  "kind": "module",
  "name": "Twitch",
  "summary": "Chat commands, EventSub triggers, and channel point redeems.",
  "author": "GreySole",
  "license": "GPL-3.0",
  "tags": [
    "stream",
    "chat"
  ],
  "spooder": "^0.6.0",
  "track": "pinned",
  "server": {
    "repo": "GreySole/Spooder-Twitch-Module",
    "version": "0.6.0",
    "asset": "spooder-twitch-module-v0.6.0.zip",
    "sha256": "5b66079dc123290211c1a2fb62a18ced5472386b8ae24afd74c34fdf20fd0421"
  },
  "webui": {
    "repo": "GreySole/Spooder-WebUI-Twitch-Module",
    "version": "0.6.0",
    "asset": "spooder-webui-twitch-module-v0.6.0.zip",
    "sha256": "bf0cd788bde39424a320d812c6bcef8aafe24efb3b188743e8c6d8caf4fad085"
  }
}
