{
  "id": "discord",
  "kind": "module",
  "name": "Discord",
  "summary": "Post to channels, react to messages, and run voice from your events.",
  "author": "GreySole",
  "license": "GPL-3.0",
  "tags": [
    "community",
    "chat",
    "voice"
  ],
  "spooder": "^0.6.0",
  "track": "latest",
  "server": {
    "repo": "GreySole/Spooder-Discord-Module"
  },
  "webui": {
    "repo": "GreySole/Spooder-WebUI-Discord-Module"
  }
}
